"//table[@name=""encounters""]/column[@name=""id""][text()=1435]/../column[@name=""strDesc""]","Your hunger sated, you lean back in the warmth of the room. The scent of dinner mingles with cedar and tobacco.

Despite the weight in your stomach, there is a sense of unrest within you.

Anxiety is pulling you toward the door. A fear is trying to convince you that every moment in here is threatening your existence.

But there is a part of you wanting to stay. Instinct is holding you fast.

You're not sure whether laziness and contentedness is putting you in danger, or if addiction is dragging you away from recovery.",你吃饱了，享受着屋子的温暖。晚餐的香味与雪松和烟草的味道相得益彰。尽管你的肚子很饱，但你内心有一种不安的感觉。焦虑把你拉向门口。内心的焦虑让你向门口走去，恐惧正让你感觉到在这里多呆一秒都是对你的威胁。但是另一个你却想让你呆在这里，本能让你克制住了自己。本能紧紧抓住你。你不确定是懒惰和满足让你处于危险之中，还是那上瘾的感觉阻止着你的恢复。
"//table[@name=""encounters""]/column[@name=""id""][text()=1500]/../column[@name=""strName""]",ATN main area.,ATN主要地区
"//table[@name=""encounters""]/column[@name=""id""][text()=1500]/../column[@name=""strDesc""]","You're standing in the Anishinaabe Tribal Nation's gathering area, by the Great Fire.

Around you, you see an area where people are sharing a meal together. Just behind this area you see a small hut with prices set on a chalkboard, and a trader of goods just outside the hut.

Further away, you see a cluster of huts near a sweat lodge, where Joe, the Nooke Midewinini, tends to the sick and wounded.",你站在Anishinaabe部落民族的聚集区，在大火旁。在你周围，你会看到一个人们正在一起用餐的区域。在你身周，你看到人们一起吃饭的地方，还有买卖的商人。再远点，你看到一些小屋在桑拿草屋附近散落着，那里是野熊氏族的药师——乔照料病人的地方。
"//table[@name=""encounters""]/column[@name=""id""][text()=1508]/../column[@name=""strName""]","ATN Warrior Conversation (female, no talk)","ATN战士对话 (女性, 无对话)"
"//table[@name=""encounters""]/column[@name=""id""][text()=1508]/../column[@name=""strDesc""]","The warrior just presses a finger to her lips, signaling silence. 

Then, she turns her attention back to the area around you, seemingly stalking something.",这位战士将一根手指按在嘴唇上，示意沉默。然后，她的注意力回到四周，看起来像是在尾随什么。
"//table[@name=""encounters""]/column[@name=""id""][text()=1509]/../column[@name=""strName""]",ATN Warrior Conversation,ATN战士对话
"//table[@name=""encounters""]/column[@name=""id""][text()=1509]/../column[@name=""strDesc""]","She seems to be gauging the surroundings for a moment, but then she turns to you, satisfied there is no danger near.",她看来像是在打量着四周的情景，然后转身望着你，似乎因为周围并无危险而松了口气。
"//table[@name=""encounters""]/column[@name=""id""][text()=1510]/../column[@name=""strName""]","ATN Warrior Conversation (male, no talk)","ATN战士对话 (男性, 无对话)"
"//table[@name=""encounters""]/column[@name=""id""][text()=1510]/../column[@name=""strDesc""]","""This is not the place for talking,"" he says, paying more attention to something beyond you.

""We may talk later.""","""这里不是说话的地方,"" 他说，并更多地关注你以外的东西。""以后再说吧。"""
"//table[@name=""encounters""]/column[@name=""id""][text()=1512]/../column[@name=""strName""]",Come to ATN cont'd,来到 ATN 续
"//table[@name=""encounters""]/column[@name=""id""][text()=1512]/../column[@name=""strDesc""]","She considers your story.

""You should speak with Michelle Lavallee, our Ajijaak elder. She is interested in these things, and knows a lot about them.""

She explains how to find her enclave.

""Just be respectful,"" she warns. ""Our warriors are accustomed to troublemakers entering our lands.""

With that, she gets back to her route. ""Wiingezin, traveler.""","她思量着你的故事。""你应该跟我们鸣鹤氏族的长老米歇尔·拉瓦利谈一谈。她对这些东西很有兴趣，而且很了解它们。""她解释着如何找到她们的聚居地。""要放尊重点，"" 她警示道。""对付惹麻烦的人对我们武士来说已经是家常便饭了。""说完她回到了自己的岗位上。""Wiingezin（别了），旅行者。"""
"//table[@name=""encounters""]/column[@name=""id""][text()=1518]/../column[@name=""strName""]",Browse the trading post.,浏览交易站的物品
"//table[@name=""encounters""]/column[@name=""id""][text()=1518]/../column[@name=""strDesc""]","The trading post seems to be a place where travelers resupply and offload items which may be of use to the Anishinaabe.

The goods inside the hut seem to be mostly food and items sold in bulk. It looks more like a storage area than a general store.

The trader outside the hut offers a variety of goods. A large portion of the inventory appears to be handmade items from local materials, and some scavenged goods.",交易站似乎是旅行者重新补充物资和卖出对阿尼什纳比部落有用的物品的地方。小屋内的货物似乎主要是食品和散装物品。它看起来更像是一个储存区，而不是一个普通的商店。小屋外的商人提供各种商品。很大一部分似乎是用当地材料手工制作的物品，还有一些捡来的货物。
"//table[@name=""encounters""]/column[@name=""id""][text()=1519]/../column[@name=""strName""]",Sit down for a meal.,坐下来吃顿饭
"//table[@name=""encounters""]/column[@name=""id""][text()=1519]/../column[@name=""strDesc""]","You approach the long table, and find an open place on the bench.

The food here is plentiful, and appears to be a mix of roasted and dried meats, roasted corn or maize, baked squash, and beans.

There is also an assortment of berries and other fruit.

Overall, the meal is hearty, with diverse flavors of savory and sweet. It fills your stomach, briefly allowing your mind to wander from minute-to-minute survival.",你走近长桌，找了个空位坐了下来。这里的食物非常丰富，有烤肉，有干肉，还有烤玉米，焙南瓜果，以及豆子。还有浆果和其他水果搭配着。总的来说，这顿饭真是非常丰盛，色香俱佳五味俱全。你吃得饱饱的，让你在分秒必争的求生之路上得到片刻的休憩。
"//table[@name=""encounters""]/column[@name=""id""][text()=1524]/../column[@name=""strName""]",Treat Illness,治疗疾病
"//table[@name=""encounters""]/column[@name=""id""][text()=1524]/../column[@name=""strDesc""]","There is an indirect science to the medicine, as well. Having observed the animal world's interaction with nature, certain plants and animals have been singled out for their healing properties.

Bear root, boiled in water to extract the medicine, can have restorative effects. Some have even reported illnesses waning under its effects.

Chewing on the root and sipping the tannin tea, your body gains a newfound energy for combating illness.

You thank Joe for his time and his help, then leave the lodge.",这种治疗方法还有间接的科学之处。人们观察着动物在自然中的行为，找出了有疗效的动植物。野芹根煮在水里释放药性，可以有滋补之用。还有人用它治好了病。嚼了嚼野芹根，呷了呷树茶，你的身体重拾了力量对抗疾病。你对乔道谢，感谢他抽出时间帮助你，然后离开了桑拿草屋。
"//table[@name=""encounters""]/column[@name=""id""][text()=1525]/../column[@name=""strName""]",Leave the village.,离开村庄
"//table[@name=""encounters""]/column[@name=""id""][text()=1525]/../column[@name=""strDesc""]","The enclave has four lightly guarded gates. There isn't much traffic but the four of them are opened all the way. They probably really trust their sentries and patrols.
			
Which gate do you want to exit from?",飞地有四个守卫森严的大门。虽然来往车辆不多，但四扇大门都是敞开的。他们可能真的很信任自己的哨兵和巡逻队。你想从哪个门出去？
"//table[@name=""encounters""]/column[@name=""id""][text()=1537]/../column[@name=""strName""]","ATN Warrior Conversation (male, brief talk)","ATN战士对话 (男性, brief talk)"
"//table[@name=""encounters""]/column[@name=""id""][text()=1537]/../column[@name=""strDesc""]","He stops a moment, sizing you up. Once satisfied, his attention seems to return to the surroundings.",他停住打量了你一会。满意后，他的注意力又回到周围。
"//table[@name=""encounters""]/column[@name=""id""][text()=1540]/../column[@name=""strName""]","ATN Warrior Conversation (female, brief talk)","ATN战士对话 (女性, brief talk)"
"//table[@name=""encounters""]/column[@name=""id""][text()=1540]/../column[@name=""strDesc""]","She raises her hand with a smile. 

""Catch anything good?""

""Boots,"" you reply.

""Ha ha, lucky!"" She waves again as you part ways.","她笑着举起了手。 ""弄到什么好东西了吗?""""有鞋子，"" 你回应道。""哈哈，挺幸运的嘛!""你们分道扬镳，她向你挥挥手。"
"//table[@name=""encounters""]/column[@name=""id""][text()=1543]/../column[@name=""strName""]",Denied Entry - Wanted,拒绝进入 - 底特律警卫队通缉
"//table[@name=""encounters""]/column[@name=""id""][text()=1543]/../column[@name=""strDesc""]","At the front of the line, the guard motions you closer. A moment of pregnant silence precedes a satisfying chirp, and the monitor flashes.

""Visitor Pass N6MAA10816 Suspect Flagged: Detain for Questioning.""

Your gut suddenly feels like a vacuum. The guard places a heavy-gloved hand on your shoulder. ""Alright, buddy, let's go.""

You're led to a gray door at the base of the south buttress, alongside a thin slit of mirrored windows.","在队伍的前头，警卫示意你靠近。先是片刻的沉默，然后监视器闪烁起来，发出令人满意的响声。""访客通行证 N6MAA10816 嫌疑人标记：拘留审问。""你的内脏突然感觉像真空一样。警卫用重重的手套抓住你的肩膀。""好吧，伙计，走吧。""你被带到南墙根部的一扇灰色门前，门旁有一条狭长的镜面窗户。"
"//table[@name=""encounters""]/column[@name=""id""][text()=1544]/../column[@name=""strName""]",Exiled from DMC,被 DMC 流放
"//table[@name=""encounters""]/column[@name=""id""][text()=1544]/../column[@name=""strDesc""]","You're escorted from the interview area, and brought into an on-site clinic, where you're strapped to a table, and anesthetized.

When you wake, you're on a bench in a painted cinder block room, leaning against a corner. Both your head and right shoulder ache. A piercing bleep fills the room as an intercom comes to life.

""You have been charged as follows:
-Assault on a Skycorps agent
-Resisting arrest
-Failure to disclose personal information""","你被护送出审讯区然后被带到临场诊所，你被绑在桌子上并被麻醉。当你醒来时，你在一个粉刷过的水泥砖房间里的长凳上，就靠在角落里。你的头和右肩都在疼。一种刺耳的哔哔声充斥着房间，对讲机开始讲话了。-袭击 Skycorps 特工 -拒捕行为 -未披露个人信息"""
"//table[@name=""encounters""]/column[@name=""id""][text()=1545]/../column[@name=""strName""]",DMC Questioning - Carrying most wanted visitor pass,底特律问询 - 携带通缉犯的通行证
"//table[@name=""encounters""]/column[@name=""id""][text()=1545]/../column[@name=""strDesc""]","By the time your case handler arrives, you've counted the ceiling tiles, grouped them into shades of beige, and created an elaborate conspiracy linking all the missing persons.

Your handler leads you to his cubicle, and you're subjected to a battery of tests, including face scan, retinal scan, DNA sampling, fingerprinting, and a blood sample.

The interview is something of a comedy, with questions like ""What is your full name, address, and date of birth?""

The handler isn't amused, however. He then asks about the bracelet and where you found it. You tell him about the strange forest, the creature that lurked in it and the lady. You can't tell if he believes you but his interest in the bracelet is evident.","当处理你案件的人到达时, 你已经把天花板分成不同米色块并细数过了，又将失踪人员联系起来编成一个阴谋故事。你被处理人带到他的隔间，进行整套录入, 包括面部扫描、视网膜扫描、DNA采样、指纹采样和血样采样。整个面谈有点像某种喜剧，伴随着像是这样的问题：""你的全名叫、住哪的、哪天出生？""然而，处理者并不感到高兴。接着他问起手镯的事，问你在哪里找到的。你讲述了那个奇怪的森林、在其中潜伏的生物和那位女士。你无法确定他是否相信你，但他对手环的兴趣显而易见。"
"//table[@name=""encounters""]/column[@name=""id""][text()=1558]/../column[@name=""strName""]",Leave.,离开
"//table[@name=""encounters""]/column[@name=""id""][text()=1558]/../column[@name=""strDesc""]","You decide not to mess with this place, and duck out of sight.",你决定不在这个地方惹事，并离开他们的视线。
"//table[@name=""encounters""]/column[@name=""id""][text()=1564]/../column[@name=""strName""]",The small frog - sick,小青蛙 - 疾病
"//table[@name=""encounters""]/column[@name=""id""][text()=1564]/../column[@name=""strDesc""]","You feel wave after wave crash down, turning cotton into rubber over your face. You try not to gag. Struggle as you might, a brook trickles up your nose when you inhale and down your throat when you swallow. You wish death would just take that last step.

When it stops, the taste of filthy water lingers on your tongue. It's all you can do to stop the waters from rising again.",你感受到一股股水流冲下，将你脸上的棉花浸湿成橡胶一般。你尽量不要插科打诨。你尽力不让自己呕出来。你希望死亡能迈出最后一步。结束的时候，你舌尖还萦绕着那恶心的水味。你唯一能做的就是让自己不把水再吐出来。
"//table[@name=""encounters""]/column[@name=""id""][text()=1565]/../column[@name=""strName""]",The small frog - safe,小青蛙 - 安全
"//table[@name=""encounters""]/column[@name=""id""][text()=1565]/../column[@name=""strDesc""]","You don't count how many times the cultist pours water over your face. You don't count how many gulps of water you swallow just so you can breathe. You don't count the pleas you make, only how many times they're heard.

When the drowning is done, the light in the room has changed. A lantern flickers and you vomit a small puddle onto the decrepit floor.",你不会数多少次邪教徒往你脸上泼水。你不会数你吞下多少口水只是为了呼吸。淹溺终于结束了，屋里的光也变了。溺水完成后，房间里的光线发生了变化。一盏灯笼闪烁着，你在破旧的地板上吐了一小滩。
"//table[@name=""encounters""]/column[@name=""id""][text()=1627]/../column[@name=""strName""]",Go to the north wing.,前往北翼
"//table[@name=""encounters""]/column[@name=""id""][text()=1627]/../column[@name=""strDesc""]","Blue banners flood the northern hallway more than any other place you've seen in the stronghold, twisting and writhing against each other from gusts of wind that shouldn't be. The smell of stagnant air turns thick. Between the dead yet unbroken fluorescents tracking the ceiling, lanterns lead your eye to a central set of doors.

Cultist engravings run around the doorframe and spill onto the surrounding walls and floor like a fungal growth. It doesn't sound like anyone's inside. You look around before testing the doors.

They're locked.",蓝色的旗帜在北翼的走廊中比你在堡垒见过的任何地方都要多，在不该出现的阵风的吹拂下，横幅相互扭曲、蠕动。陈腐的空气味道变得浓厚。死气沉沉却未坏的荧光灯在天花板上闪烁，灯笼将你的视线引向中央的一组门。门框上刻有邪教的铭文，蔓延到周围的墙壁和地板上，如同真菌般生长。里面似乎没有人。你环顾四周，然后试着推门。门是锁着的。
"//table[@name=""encounters""]/column[@name=""id""][text()=1663]/../column[@name=""strName""]",Quickly pick the locked door and head inside.,快速撬开锁上的门，进入里面。
"//table[@name=""encounters""]/column[@name=""id""][text()=1663]/../column[@name=""strDesc""]","You wonder why you went through all the trouble of picking the door lock and slipping inside. The room is mostly bereft not only of anything valuable, but even of character. No trophies, no weapons, no history. What few things there are congregate in the far corner, surrounding themselves with emptiness.

There does appear to be a safe, however, flanked by a mattress and a pot.",你不明白为什么要费尽周折撬开门锁溜进去。房间里不仅没有任何值钱的东西，甚至没有任何特色。没有战利品，没有武器，没有历史。仅有的几样东西都集中在最角落里，周围空荡荡的。不过，房间里确实有一个保险箱，旁边摆放着一张床垫和一个锅。
"//table[@name=""encounters""]/column[@name=""id""][text()=1725]/../column[@name=""strName""]",Scavenge Black Swamp ruins.,搜刮黑沼泽废墟
"//table[@name=""encounters""]/column[@name=""id""][text()=1725]/../column[@name=""strDesc""]","There is little left to explore in this burnt, toxic swamp. This ruin, however, looks like it might have a few caches that escaped complete destruction.

Getting to them, however, is going to be a trick. Rubble threatens to collapse at the slightest touch, and caustic liquid pools here and there.

The good news? You suspect little scavenging competition in this blasted swamp.",在这片燃烧殆尽的毒沼泽中，几乎没什么可探索的了。然而，这个废墟看起来可能有一些没有被彻底摧毁的藏宝处。然而，要接近它们会很冒险。废墟稍稍一碰可能就会倒塌，而腐蚀性的液体到处都是。好消息呢?你怀疑这该死的沼泽里几乎没有其他拾荒者跟你抢。
"//table[@name=""encounters""]/column[@name=""id""][text()=1726]/../column[@name=""strName""]",Scavenge a forested crash site.,搜刮杂草重生的坠毁点
"//table[@name=""encounters""]/column[@name=""id""][text()=1726]/../column[@name=""strDesc""]","You've stumbled across a crash site.

It looks like a hover truck went down here, crashing through trees and dirt, and scattering it nearby.

There's been a lot of damage in the impact and subsequent fire, but you may find some useful stuff in the wreckage.",你偶然发现了一个坠毁地点。看起来像是一辆悬浮卡车在这里坠毁，撞开了树木和泥土，并在附近散落。在撞击和随后的火灾中造成了很多损害，但你可以在残骸中找到一些有用的东西。
"//table[@name=""encounters""]/column[@name=""id""][text()=1727]/../column[@name=""strName""]",Scavenge a swamp crash site.,搜刮沼泽的坠毁点
"//table[@name=""encounters""]/column[@name=""id""][text()=1727]/../column[@name=""strDesc""]","You've stumbled across a crash site.

It looks like part of a hover convoy went down here. Vehicle wreckage and containers are spread over the crash site, and peek out of the swamp.

Fire, corrosion, and the crash have taken their toll, but you're betting few scavengers have been through this dismal swamp yet, so the pickings may be good.",你偶然发现了一个坠毁地点。看起来像是一个悬浮车队的一部分在这里坠毁了。车辆残骸和集装箱分散在坠毁现场，并从沼泽地里探出头来。火灾、腐蚀和坠毁已经造成了影响，但你敢打赌，很少有拾荒者穿过这片荒凉的沼泽地，所以应该能捡到不少好东西。
"//table[@name=""encounters""]/column[@name=""id""][text()=1748]/../column[@name=""strName""]",Outside Saginaw - Wraith,萨吉诺外-幽灵
"//table[@name=""encounters""]/column[@name=""id""][text()=1748]/../column[@name=""strDesc""]","You stop dead in your tracks when a scattering shadow appears before you, resolving its formlessness from thin air, making and unmaking itself along its fringes. Below a pale mask on what looks like its head, a bronze light burns. And there is fury in the light.

With a movement no human body could make, the wraith hurls something at you, then vanishes. You nearly fall back at the force, but manage to stay upright.

You look down. It's a crumpled gas mask with a broken beak.",当一个散射的影子出现在你面前时，你突然停了下来，凭空化解了它的无形，沿着它的边缘制造和分解自己。在看起来像它头上的苍白面具下面，一盏青铜色的灯在燃烧。光明中有愤怒。用一个人体无法做出的动作，幽灵向你扔了什么东西，然后消失了。你几乎在原力下后退，但设法保持直立。你往下看。这是一个皱巴巴的防毒面具，喙断了。
"//table[@name=""encounters""]/column[@name=""id""][text()=1756]/../column[@name=""strName""]",Go upstairs.,上楼去。
"//table[@name=""encounters""]/column[@name=""id""][text()=1756]/../column[@name=""strDesc""]","Climbing over debris up the stairs, you reach a T intersection, with the living room opening up to your right. There is a musty smell up here, with a faint, sickening sweetness.

Across the living room, you see a hutch surrounded by broken dishes. And atop it, a silver urn.

You cross the moldy room to the hutch, retrieve the urn, and look closely at it. Doesn't seem like much, but to each there is a treasure.",爬上楼梯的碎片，你到达一个丁字路口，客厅在你的右边。这里有一股霉味，还有一股淡淡的、令人作呕的甜味。穿过客厅，你会看到一个被碎盘子包围的橱柜。在它上面，一个银瓮。你穿过发霉的房间来到橱柜前，取回骨灰盒，仔细观察它。看起来不多，但对每个人来说都有一笔财富。
"//table[@name=""encounters""]/column[@name=""id""][text()=1794]/../column[@name=""strName""]",Found Clearbone Valley,找到了Clearbone Valley
"//table[@name=""encounters""]/column[@name=""id""][text()=1794]/../column[@name=""strDesc""]","As you round a corner, you nearly miss it: a reinforced door inset into a brush-covered slope nearby. With the exception of a white button next to the door, there are no other signs of life nearby.",当你绕过一个拐角时，你几乎错过了它：附近一个灌木丛覆盖的斜坡上有一扇加固的门。除了门旁边的一个白色按钮，附近没有其他生命迹象。
"//table[@name=""encounters""]/column[@name=""id""][text()=1803]/../column[@name=""strName""]",Ask about Elias.,问问伊莱亚斯。
"//table[@name=""encounters""]/column[@name=""id""][text()=1803]/../column[@name=""strDesc""]","""Elias was a bit of a strange man, I admit,"" Samantha says. ""But he was good to us, and he was always so happy to see us. He could only come home once or twice a month, and for no more than a day or two at a time. But when he was here, he was really here, you know? And he never took his work home with him.""

She pauses. ""Then again, why would he? Being a medicine courier hardly seems that taxing.""",“我承认，埃利亚斯是个有点奇怪的人，”萨曼莎说。“但他对我们很好，见到我们总是很高兴。他一个月只能回家一两次，每次不超过一两天。但当他在这里的时候，他真的在这里，你知道吗？而且他从来没有把工作带回家。”她停顿了一下。“话说回来，他为什么要这么做？成为一名药品快递员似乎并没有那么费力。”
"//table[@name=""encounters""]/column[@name=""id""][text()=1824]/../column[@name=""strName""]",Bishop Wraith Appears,幽灵主教出现
"//table[@name=""encounters""]/column[@name=""id""][text()=1824]/../column[@name=""strDesc""]","As the King of the Blue Frog cult lies dead at your feet, a blast of pallid light infests and dries the air with a sudden roar. You feel something coming from behind you. And you turn.

A surge of blackest shadow twists out of itself before you, swelling with such intensity that shards of darkness are shed from its being. A bone-white mask with hollow eyes crowns the being. An eerie yellow light glows beneath it, rumbling with rage.

An instant later, it folds upon itself and disappears.

When you can see your surroundings again, you find the King's body unmoved. A few feet away, a gas mask is torn in half, right down its beak.",当蓝蛙邪教的国王死在你的脚下时，一阵苍白的光突然咆哮，侵入并干燥了空气。你感觉到有东西从你身后传来。然后你转身。一股最黑的影子在你面前扭曲出来，膨胀得如此强烈，以至于黑暗的碎片从它的存在中脱落。一个带着空洞眼睛的骨白色面具给这个生物加冕。它下面闪烁着诡异的黄光，愤怒地隆隆作响。片刻后，它折叠起来消失了。当你再次看到周围的环境时，你发现国王的尸体一动不动。几英尺外，一个防毒面具被撕成了两半，就在它的喙下面。
"//table[@name=""encounters""]/column[@name=""id""][text()=1826]/../column[@name=""strName""]",Try to broker a deal for the Blue Rot materials.,试着促成一笔蓝腐材料的交易。
