"//table[@name=""encounters""]/column[@name=""id""][text()=216]/../column[@name=""strDesc""]","""Ol' Gertrude's mine. Saber-toothed tiger. Made 'er myself."" Bob waves his hands, encompassing most of the well-equipped room. ""Surprising whatcha can rig with the right kit and plenny of time on yer hands. Saw a fancy version once. In a museum. Made myself a copy, or two. Metal version.""

""First one left before I could even name 'er. Messed 'er code up somewhere, I reckon."" he continues.

""Trouble is, certain folk jus' don't get it. Get that I provide a desirable service to the locals. Don't like what I do."" Bob picks up a modified food can and tosses it over to you. ""See that? RTG power cell. Couple a thermocouples hooked up to a pew two-three-eight isotope. Hot bricks, I call 'em. Enough power there ta keep the lights on 'til winter.""",“老格特鲁德是我的。剑齿虎。我自己做的。”鲍勃挥挥手，包围了大部分设备齐全的房间。“令人惊讶的是，您可以使用正确的套件和充足的时间来装备。看过一次花哨的版本。在博物馆里。给自己复印了一两份。金属版。”“我还没来得及说出儿的名字，第一个就走了。我猜是她把密码弄乱了。”他继续说道。“问题是，有些人不明白。让我为当地人提供令人满意的服务。不喜欢我做的事。”鲍勃拿起一个改良食品罐，扔给你。“看到了吗？破损的RTG电池将热电偶连接到皮尤二三八同位素上。我称之为热砖。那里的电力足够让灯亮到冬天。”
"//table[@name=""encounters""]/column[@name=""id""][text()=225]/../column[@name=""strName""]",Look over Gertrude's code cont'd.,看看格特鲁德的密码。
"//table[@name=""encounters""]/column[@name=""id""][text()=225]/../column[@name=""strDesc""]","Bob reaches into a nearby cupboard and pulls out a strange object which he passes to you. ""A fella like you might find a use for this one day.""

Staring at it, you doubt it. Your days of playing with dolls are long gone. The dolls of your childhood were all action figures, not strange-looking mechanical contraptions like this one. Still, a gift is a gift.

""A good Samaritan, then, lucky me. Don't forget to visit, I might have things to trade with ya,"" he says.

You thank Bob and get on your way, hoping you didn't pick up too many rads from that tiger.",鲍勃把手伸进附近的橱柜，拿出一个奇怪的东西递给你。“像你这样的家伙，总有一天会用得上这个的。”盯着它，你怀疑它。你玩洋娃娃的日子早已一去不复返了。你童年时的洋娃娃都是活动人偶，而不是像这个这样看起来很奇怪的机械装置。尽管如此，礼物就是礼物。“那么，一个好撒玛利亚人，我很幸运。别忘了去看看，我可能有东西要和你交易，”他说。你感谢鲍勃，然后上路，希望你没有从那只老虎身上得到太多的拉德。
"//table[@name=""encounters""]/column[@name=""id""][text()=226]/../column[@name=""strName""]",Offer to do what you can cont'd.,主动提出尽你所能。
"//table[@name=""encounters""]/column[@name=""id""][text()=226]/../column[@name=""strDesc""]","Ten minutes later you begin to feel warm. Twenty minutes in and you're so hot that sweat is starting to roll down your cheeks and drip, drip, dripping onto the inner workings of the tiger. Investigating, you determine that the heat is emanating from the rear of the beast. Opening a hatch cover, one of Bob's 'hot bricks' peeks cheekily out at you.

With a start, you remember. A jury-rigged food can, power cell full of plutonium isotopes. Bad. Disastrously bad.

Disgusted, you give the beast a hefty kick and leave, searching for Bob to tell him that he'll have to fix it himself. Still angry, you wonder if you have Bob to thank for cancer now.",十分钟后，你开始感到温暖。二十分钟后，你太热了，汗水开始从你的脸颊滚下来，滴，滴到老虎的内部。通过调查，你确定热量是从野兽的后部散发出来的。打开舱门，鲍勃的一块“热砖”厚颜无耻地向你窥视。一开始，你就记得。陪审团操纵的食品罐，充满钚同位素的电池。坏的。糟糕透顶。厌恶地，你给了野兽一个沉重的踢，然后离开，寻找鲍勃告诉他，他将不得不自己修理它。仍然很生气，你想知道你现在是否要感谢鲍勃的癌症。
"//table[@name=""encounters""]/column[@name=""id""][text()=227]/../column[@name=""strName""]",Treat Bob's rad poisoning cont'd.,继续治疗鲍勃的放射性中毒。
"//table[@name=""encounters""]/column[@name=""id""][text()=227]/../column[@name=""strDesc""]","""Can't say I feel any different. Can't feel my hair growing back. Sure that gizmo is working?"" 

You assure Bob that he is now a healthier man and will live to see next Christmas.

""No kidding? Gizmo is that good, huh? Well that's mighty fine of you to help. Tell you what, here's a little something in return."" Bob hands across an average-sized doll. A mechanical, not particularly attractive, doll. ""Don't be put off by its ugly mug; could come in handy one day.""

Underwhelmed by Bob's generosity, you get the distinct feeling that you've been had. Of course, so might he.

""Come again,"" gushes an effusive Bob, shaking your hands. ""Always welcome. Who knows, I might need another shot from the gizmo one day. Let me walk you out. Don't want ol' Gertie thinking you're a damn guva-munt agent, do we?""",“不能说我感觉有什么不同。感觉不到我的头发长回来了。你确定这个小发明能用吗？”你向鲍勃保证，他现在是一个更健康的人，会活着看到明年圣诞节。“没开玩笑吧？小发明很棒，是吧？你能帮忙真是太好了。告诉你吧，这里有一点回报。”鲍勃递给一个中等大小的洋娃娃。一个机械的，不是特别吸引人的娃娃。“别被它丑陋的杯子吓跑了，总有一天它会派上用场的。”鲍勃的慷慨给你留下了深刻的印象，你会明显地感觉到你被欺骗了。当然，他也可能会。“再来，”鲍勃热情洋溢地和你握手。总能成功。谁知道呢，有一天我可能需要从这个小发明中再拍一张照片。让我送你出去。你可不想让老格蒂以为你是个该死的古瓦蒙特特工吧？”
"//table[@name=""encounters""]/column[@name=""id""][text()=229]/../column[@name=""strName""]",Exchange the talisman for the rifle.,把护身符换成步枪。
"//table[@name=""encounters""]/column[@name=""id""][text()=229]/../column[@name=""strDesc""]","""Hey, that's real generous of you. Here, may as well take this clip with ammo, too. Could be helpful out there. Promise you'll save a bullet for any guva-munt agents you cross. Aim for their peckers!"" Bob doubles up in another spasm of asthmatic laughter. Recovering, he turns suddenly serious.

""You need ta head ta the DMC, fella. Safer. Go straight there. The black marsh to the south'll kill ya dead, and the north ain't much better. Head straight for the gates. I've heard bad things happen to those that take the scenic route.""

Bob shakes your hand and wishes you well. ""I'll deactivate Gertrude so you can leave. Be seein' you.""",“嘿，你真是太慷慨了。在这里，不妨把这个弹夹和弹药一起拿走。可能会有帮助。答应我你会为你遇到的任何guva-munt特工省下一颗子弹。瞄准他们的老二！”鲍勃又笑得喘不过气来。恢复中，他突然变得严肃起来。“你需要ta领导Ta DMC，伙计。更安全。一直往那里走。南边的黑沼泽会杀了你，北边也好不到哪里去。直奔大门。我听说过那些走风景优美路线的人会发生不好的事情。”鲍勃和你握手，祝你一切顺利。“我会让格特鲁德停用，这样你就可以离开了。再见。”
"//table[@name=""encounters""]/column[@name=""id""][text()=232]/../column[@name=""strName""]",Exchange the talisman for the location.,用护身符换位置。
"//table[@name=""encounters""]/column[@name=""id""][text()=232]/../column[@name=""strDesc""]","""Alright. Deal's a deal. Yer lookin' fer the Allegan Fairgrounds. A bit northwest of here. Can't miss it. Acres and acres. Even got a ferris wheel."" Then he mocks a frightened look, ""Just watch fer clowns!"" Bob doubles up in another spasm of asthmatic laughter. Recovering, he turns suddenly serious.

""Serious now, don't dally there for long. Get watcha need and get out. Best bet is ta head ta the DMC, fella. Safer. And when ya do, go straight there. The black marsh to the south'll kill ya dead, and the north ain't much better. Head straight for the gates. I've heard bad things happen to those that take the scenic route.""

Bob shakes your hand and wishes you well. ""I'll deactivate Gertrude so you can leave. Be seein' you.""","""很好。一言为定。你在找阿勒根游乐场。就在这里的西北方向。不能错过。一英亩又一英亩。甚至还有摩天轮。”然后他嘲笑一个害怕的表情，“看看小丑！”鲍勃又笑得喘不过气来。恢复中，他突然变得严肃起来。“说真的，别在那里磨蹭太久了。得到你需要的手表，然后出去。最好的办法就是去DMC，伙计。更安全。当你这样做的时候，直接去那里。南边的黑沼泽会杀了你，北边也好不到哪里去。直奔大门。我听说过那些走风景优美路线的人会发生不好的事情。”鲍勃和你握手，祝你一切顺利。“我会让格特鲁德停用，这样你就可以离开了。再见。”"
"//table[@name=""encounters""]/column[@name=""id""][text()=234]/../column[@name=""strName""]",Leaving the Mine Lobby,离开矿山大厅
"//table[@name=""encounters""]/column[@name=""id""][text()=234]/../column[@name=""strDesc""]","But no tiger appears.
			
You make it to the door, shoulder it open without breaking stride, and keep running.",但是没有老虎出现。你走到门口，用肩膀打开门，不要停下脚步，继续跑。
"//table[@name=""encounters""]/column[@name=""id""][text()=235]/../column[@name=""strName""]",Leaving the Mine Lobby,离开矿山大厅
"//table[@name=""encounters""]/column[@name=""id""][text()=235]/../column[@name=""strDesc""]","But not fast enough.

With a wobbly, mechanical pounce, the saber-toothed terror is upon you. Knocked sideways, you feel sharp metal fangs rake across your back, but you retain your feet and manage to stagger out the entrance door. You can hear the tiger ricocheting off the walls back in the mine lobby.

Despite the pain, you run the length of the ravine, putting the Isotope Mine out of sight and out of mind. You finally come to a halt at the head of the trail and attempt to do something about the gaping wounds in your back. It's not the loss of blood or the flapping flesh that worries you; it's infection.

Those fangs looked about as sterile as a bucket full of flyblown moose gizzards.",但还不够快。随着一个摇摇欲坠的机械猛扑，剑齿虎的恐怖向你袭来。被撞到一边，你会感觉到锋利的金属尖牙掠过你的背部，但你保持住了双脚，并设法摇摇晃晃地走出了大门。你可以听到老虎从矿井大厅的墙上弹跳的声音。尽管很痛苦，你还是跑过了峡谷的长度，把同位素矿看不见也想不起来。你终于在小路的尽头停下来，试图对你背上裂开的伤口做些什么。让你担心的不是失血或拍打的肉；是感染。那些尖牙看起来就像一桶被苍蝇吹走的驼鹿腮一样无菌。
"//table[@name=""encounters""]/column[@name=""id""][text()=237]/../column[@name=""strName""]",Reenter the cryo chamber.,重新进入冷冻室
"//table[@name=""encounters""]/column[@name=""id""][text()=237]/../column[@name=""strDesc""]","Back in the cryo chamber, you still feel echoes of the panic that gripped you when you awoke here. It leaves you feeling unsettled.

However, that time has passed. Maybe it's time to look around again?",回到冷冻室后，当你在这里醒来时的恐慌仍然回荡在你的心中，这让你感到不安。它让你感到不安。然而，那段时间已经过去了。也许现在是时候再看看周围了？
"//table[@name=""encounters""]/column[@name=""id""][text()=238]/../column[@name=""strName""]",Explore down the hall.,沿着大厅探索
"//table[@name=""encounters""]/column[@name=""id""][text()=238]/../column[@name=""strDesc""]","Outside the cryo chamber, there's a debris-filled corridor that looks disused. You climb over piles of refuse and rubble, and come across several rooms in poor condition.
			
You find a closed room. The door and access panel are functional but locked. A plaque on the wall reads: ""Exam Rm 14""
			
You decide to continue down the corridor. You eventually find a blocked doorway. A plaque on the wall reads: ""Exam Rm 17""

Forcing the barricade aside, you peer into what looks like a clinic exam room. While there appears to be little worth looting, this room looks like it'd make a great hole-up site.

(Exam Room 17 has been added to this hex's campsites.)","在冷冻室外面，有一条充满碎石的走廊，看起来已经废弃。你爬过成堆的垃圾和瓦砾，发现了几个状况不佳的房间。你找到一个房间。门和进入面板是功能性的，但锁定了。墙上有一块牌子，上面写着：""检查室 14"" 你决定继续沿着走廊走。最终，你找到了一个被堵住的门口。墙上的牌子写着：""检查室 17"" 强行推开障碍，你窥视着一个看起来像诊所的检查室。虽然这里没什么值得拿走的东西，但这个房间看起来是个很好的藏身之处。（17号检查室已被添加到营地列表中）"
"//table[@name=""encounters""]/column[@name=""id""][text()=422]/../column[@name=""strName""]",Good 1.1,良好1.1
"//table[@name=""encounters""]/column[@name=""id""][text()=422]/../column[@name=""strDesc""]","Sitting on a decaying park bench, aiming his gun at your chest, is a scarred, flint-eyed man. From the kit and urban camo clothing, you can tell he's ronin. A gun for hire. He's airing his feet, one profusely bleeding from a recent gash. Probably the same gash that caused that rip through the sole of his shoe. A lot of sharp metal around these parts.

The pain must be affecting his grip on the rifle. It's wavering. Maybe enough for you to safely dive off to the side. He's not saying anything. Just sitting there, staring.",坐在一张破旧的公园长椅上，用枪指着你的胸口，是一个伤痕累累、目光冷酷的男人。从装备和城市迷彩服，你可以看出他是浪人。一把出租的枪。他正在晾干他的脚，一只脚因最近的伤口而大量出血。很可能是导致他鞋底撕裂的同一个伤口。这些零件周围有很多锋利的金属。疼痛一定影响了他对步枪的握持。它在摇摆不定。也许足以让你安全地跳到一边。他什么都没说。只是坐在那里，盯着看。
"//table[@name=""encounters""]/column[@name=""id""][text()=441]/../column[@name=""strName""]","Only thing better than a nearly dead ronin is a dead one. Finish him. Otherwise, he might recover.",唯一比快死的浪人好的就是死了的浪人。干掉他。否则，他可能会康复。
"//table[@name=""encounters""]/column[@name=""id""][text()=441]/../column[@name=""strDesc""]","Rock to the head. Man, did he have to splatter so much blood onto you? It's like he wanted to spite you one more time.

Hope he didn't have any of those nasty blood borne diseases.",摇摇头。伙计，他非得把这么多血溅到你身上吗？好像他想再来一次刁难你。希望他没有那些讨厌的血液传播疾病。
"//table[@name=""encounters""]/column[@name=""id""][text()=442]/../column[@name=""strName""]","Only thing better than a nearly dead ronin is a dead one. Finish him. Otherwise, he might recover.",唯一比快死的浪人好的就是死了的浪人。干掉他。否则，他可能会康复。
"//table[@name=""encounters""]/column[@name=""id""][text()=442]/../column[@name=""strDesc""]","Rock to the head. Man, did he have to splatter so much blood onto you? It's like he wanted to spite you one more time.

Hope he didn't have any of those nasty blood borne diseases.",摇摇头。伙计，他非得把这么多血溅到你身上吗？好像他想再来一次刁难你。希望他没有那些讨厌的血液传播疾病。
"//table[@name=""encounters""]/column[@name=""id""][text()=628]/../column[@name=""strName""]",Meat Peddler Warning,肉贩警告
"//table[@name=""encounters""]/column[@name=""id""][text()=628]/../column[@name=""strDesc""]","You plead with the butcher, and explain that it must be some mistake. You don't kill humans for meat, honest!

Giving you a sidelong stare, the butcher considers your plea. ""If I ever,"" he points a carving knife at you, ""and I mean EVER, see you in here offloading that stuff again..."" His knife jabs point-first into a stall table, nearly splitting the wood.

""Now get yourself out of my sight, or else!"" he spits as he walks back to his stall.

""You should leave now, lad."" another merchant advices. ""Come back in few days or in a week. Things should be calmer by then.""","你恳求着屠夫，解释说肯定是误会了。你不会为了肉而杀人,千真万确!他斜眼瞄着你，思索着你的恳求。""如果我哪天，"" 他用刻刀指着你， ""我说只要哪天，再看到你搬着那东西...""他把刀一把插到砧板上，都快把砧板切开了。""现在马上滚出我的视线，否则!"" 他一边吐着口水一边走回他的摊位。""你现在应该离开，小伙子。"" 另一位商人建议道。""几天后或一周后再来吧。到时候事情应该会平息下来。 """
"//table[@name=""encounters""]/column[@name=""id""][text()=812]/../column[@name=""strName""]",Enter the Red Gnome.,进入红侏儒
"//table[@name=""encounters""]/column[@name=""id""][text()=812]/../column[@name=""strDesc""]","Pushing through the stainless steel door, a rush of warm, greasy air fills your nose, replacing the damp coolness from outside. Your stomach ""urps"" almost instantly, in anticipation of whatever you smell on the grill.

The decor is somewhat less inviting, however. Despite a number of lights, most of them seem incapable of dispelling the dimness in the space. And sepia-stained curio along the walls seem to capture more of the creepy awkwardness of the diner's history than nostalgia. Padded stools line the long countertop, and booths run the length of the outer wall, sporting ripped vinyl benches. A stark pattern of 1-inch tiles dots the floor.

Not surprising, in retrospect, that the take-out line was so long. Still, an open seat and a warm meal are promised land compared to eating condensed soup in the rain. You shove your stuff into an empty booth, and start paging through the laminated menu.",推开不锈钢的门，一股温暖油腻的空气扑面而来，取代了外面湿冷的气息。你的胃几乎立刻有些不适，是对烤架上气味的预感。然而，装潢就不那么令人愉快了。尽管有不少灯光，但大多数灯似乎无法驱散空间中的昏暗。墙上的棕褐色古董装饰似乎捕捉了更多餐馆历史中的怪异气氛，而不是怀旧感。长长的台面上摆满了有垫子的凳子，外墙沿线的包厢有破损的乙烯基长椅。地板上点缀着一寸见方的明显图案瓷砖。回头看来，外卖队伍那么长也就不足为奇了。尽管如此，与在雨中吃浓缩汤相比，一个空座位和一顿热饭就显得像是应许之地。你把东西塞进一个空包厢，开始翻阅那本塑料封面的菜单。
"//table[@name=""encounters""]/column[@name=""id""][text()=813]/../column[@name=""strName""]","Order Combo 1: Fried chicken, mac and cheese, and red beans with rice. Price - $24.50",套餐一：炸鸡，吉士汉堡，红豆饭。价格 - $24.50
"//table[@name=""encounters""]/column[@name=""id""][text()=813]/../column[@name=""strDesc""]","For once, fried chicken might be the healthiest thing for you. After days in the wild, a little bit of body fat might actually do you some good!

When it arrives, you can almost taste the greasy spices from its intoxicating scent. Forgoing utensils, you dive into the chicken, and it slides easily off the bone, into your gullet.

The mac and cheese is rich and creamy, and the beans and rice feels like it'll fill your stomach for days. If paradise was a dish, it'd be fried chicken in front of a starving scavenger.",这一次，炸鸡可能算是健康的食物了。因为在野外的日子，有一点脂肪可能确实对你会有好处。当菜端上来时，你几乎可以闻到那油腻腻的香料所散发出的醉人香味。拿起餐具，你开始吃那炸鸡，它是吃起来那样的美味香滑。通心粉和奶酪量多且爽口，豆子和米饭感觉可以填饱你的肚子好几天。如果天堂是一道菜，那它绝对就是一盘放在拾荒者面前的炸鸡了。
"//table[@name=""encounters""]/column[@name=""id""][text()=816]/../column[@name=""strName""]","Order Combo 3: Cadillac burger, mashed potatoes with gravy, and cornbread. Price - $32.50",套餐三：凯迪拉克汉堡，肉汁土豆泥，玉米面包。价格 - $32.50
"//table[@name=""encounters""]/column[@name=""id""][text()=816]/../column[@name=""strDesc""]","In true diner fashion, you don't have to wait long for your plate. It arrives hot, the aroma of gravy, cornbread, and beef carried by thin wisps of steam.

The burger is more meatloaf than patty, topped with elbow macaroni and ketchup. What this has to do with a Cadillac, you're not sure.

But man, does it ever hit the spot. As you smush the soft food around your mouth, you look around the room at the various photos and decor.",在真正的餐馆中，你不必为上菜而等待太久。店家会为你端上热气腾腾的充满肉汁香气的玉米面包，还有一份用蒸汽蒸熟的牛肉。汉堡比肉饼更像是肉饼，上面浇满了通心粉和番茄酱。这与凯迪拉克有什么关系，你不确定。但是，伙计，这些都没有说到点子上。你环顾着房间里的各种照片和装饰，就像你把柔软的食物塞进嘴里时地动作那么顺畅。
"//table[@name=""encounters""]/column[@name=""id""][text()=817]/../column[@name=""strName""]","Order Combo 2: Jumbo fried shrimp, collard greens, black-eyed peas, and peach cobbler. Price: - $20",套餐二：巨型炸虾，菠菜，豇豆，桃汁。 价格：- $20
"//table[@name=""encounters""]/column[@name=""id""][text()=817]/../column[@name=""strDesc""]","Your eyes fixated on the kitchen door, you wait impatiently for the food. Doesn't even have to be your order. You'll gladly accept a misdelivered plate.

When it does arrive, you have to restrain yourself from going feral on the dinner. With some effort, you take a controlled bite of the first piece of shrimp.

Your mouth floods with saliva. There's a stinging sensation radiating from the side of your tongue as flavor drips over it.

Pecking around the plate, you sample the sides, mixing them in your mouth. The savory flavors compliment each other, rounded out by the sweet and sour of the peach.",你的眼睛紧盯着厨房的门口，不耐烦地等待着食物。甚至不一定是你点的菜。你会很乐意接受一个送错的盘子。上菜了之后，你不得不克制自己，避免在晚餐上狼吞虎咽。经过努力，你优雅的吞下了第一口虾肉。你的嘴里充斥着唾液。当食物刺激到了你的味蕾时，那味道从你舌头的两侧慢慢的蔓延开来。桌上的盘子转了一圈，你尝了一下两边的配菜，把它们在嘴里混合起来。咸味相互补充，再加上桃子的酸甜味，使之更加完美。
"//table[@name=""encounters""]/column[@name=""id""][text()=820]/../column[@name=""strName""]",Pay for the meal.,结账
"//table[@name=""encounters""]/column[@name=""id""][text()=820]/../column[@name=""strDesc""]","It's one of the pricier meals, but you suspect getting real beef in this city is a tall order. And judging by the business this place is doing through take-out, it doesn't have much competition. At least, not out here between Core City and the walls.

You pay for the meal, then a thought occurs to you: do people still tip?",这真是一顿昂贵的饭，但是你怀疑在这个城市吃到真正的牛肉是一件难事。从这个地方的外卖业务来看，它没有多少竞争。至少没有在核心城和城墙之间。你付了饭钱，然后突然想到：人们还会给小费吗？
"//table[@name=""encounters""]/column[@name=""id""][text()=826]/../column[@name=""strName""]",Pay the bill.,买单
"//table[@name=""encounters""]/column[@name=""id""][text()=826]/../column[@name=""strDesc""]","Real shrimp in Detroit, huh? You guess that's not impossible. Shrimp farming is pretty high-density stuff.

And $20 is hardly a cheap plate. But hey, that feeling in your stomach is worth almost any price.

You pay for the meal, then a thought occurs to you: do people still tip?",底特律还有真正的虾？你猜这不是不可能的。虾的养殖是相当高密度的东西。而且20美元算不上一顿便宜的餐。但是，嘿，你肚子里的那种感觉几乎是值得的。你为这顿饭付了钱，然后你想到了一个问题：人们还会给小费吗？
"//table[@name=""encounters""]/column[@name=""id""][text()=832]/../column[@name=""strName""]",Enter the Red Gnome.,进入红侏儒
