"//table[@name=""encounters""]/column[@name=""id""][text()=1048]/../column[@name=""strDesc""]","You opt for safety, and grab hold of the ladder again. One of the catwalk's moorings pulls free from the wall with a spout of concrete dust, and the walkway swings downward violently, smashing against a pipe.

With nowhere to go but up, you start climbing, and emerge on the surface again.

Whatever awaits down there will have to wait for someone better prepared.

Or suicidal.",你选择安全，再次抓住梯子。一个舷梯的系泊装置随着一股混凝土灰尘从墙上脱落，走道猛烈地向下摆动，撞到了一根管道。除了向上无处可去，你开始攀登，并再次浮出水面。无论下面等待着什么，都必须等待准备更充分的人。或者自杀。
"//table[@name=""encounters""]/column[@name=""id""][text()=1063]/../column[@name=""strName""]","Jump Success, Lose Right Hand Item",跳转成功，失去右手物品
"//table[@name=""encounters""]/column[@name=""id""][text()=1063]/../column[@name=""strDesc""]","The rung hits your hand before you see it in this darkness, and you scramble to grab on before it slips away.

You lose your grip on what you were holding, though.

Pulling with desperation, you manage to hook an elbow over the rung, and catch your breath.

The sounds of dislodged concrete clang from below, disturbed by your jump.

You throw your free arm upward to the next rung, and pull with both arms to get a knee up. And then, it's just a ladder.

You slow your breathing, concentrate on not slipping, and climb back to the surface.

The outside world seems loud and windy by comparison. 

But also safe.",在黑暗中，你还没看到横档就撞到了你的手，你就在它溜走之前争先恐后地抓住它。然而，你失去了对你所持有的东西的控制。绝望地拉着，你设法把一只胳膊肘钩在横档上，然后屏住呼吸。被你的跳跃打断的混凝土从下面发出的铿锵声。你把你的自由手臂向上扔到下一个横档，用双臂拉，让一个膝盖向上。然后，它只是一个梯子。你放慢呼吸，集中精力不滑倒，爬回水面。相比之下，外面的世界显得喧闹多风。但也很安全。
"//table[@name=""encounters""]/column[@name=""id""][text()=1064]/../column[@name=""strName""]","Jump Success, Lose Left Hand Item",跳转成功，失去左手物品
"//table[@name=""encounters""]/column[@name=""id""][text()=1064]/../column[@name=""strDesc""]","The rung hits your hand before you see it in this darkness, and you scramble to grab on before it slips away.

You lose your grip on what you were holding, though.

Pulling with desperation, you manage to hook an elbow over the rung, and catch your breath.

The sounds of dislodged concrete clang from below, disturbed by your jump.

You throw your free arm upward to the next rung, and pull with both arms to get a knee up. And then, it's just a ladder.

You slow your breathing, concentrate on not slipping, and climb back to the surface.

The outside world seems loud and windy by comparison. 

But also safe.",在黑暗中，你还没看到横档就撞到了你的手，你就在它溜走之前争先恐后地抓住它。然而，你失去了对你所持有的东西的控制。绝望地拉着，你设法把一只胳膊肘钩在横档上，然后屏住呼吸。被你的跳跃打断的混凝土从下面发出的铿锵声。你把你的自由手臂向上扔到下一个横档，用双臂拉，让一个膝盖向上。然后，它只是一个梯子。你放慢呼吸，集中精力不滑倒，爬回水面。相比之下，外面的世界显得喧闹多风。但也很安全。
"//table[@name=""encounters""]/column[@name=""id""][text()=1065]/../column[@name=""strName""]","Jump Success, Lose Backpack Item",跳跃成功，丢失背包物品
"//table[@name=""encounters""]/column[@name=""id""][text()=1065]/../column[@name=""strDesc""]","The rung hits your hand before you see it in this darkness, and you scramble to grab on before it slips away.

Your backpack slips loose, though.

Pulling with desperation, you manage to hook an elbow over the rung, and catch your breath.

The sounds of dislodged concrete clang from below, disturbed by your jump.

You throw your free arm upward to the next rung, and pull with both arms to get a knee up. And then, it's just a ladder.

You slow your breathing, concentrate on not slipping, and climb back to the surface.

The outside world seems loud and windy by comparison. 

But also safe.",在黑暗中，你还没看到横档就撞到了你的手，你就在它溜走之前争先恐后地抓住它。不过，你的背包松了。绝望地拉着，你设法把一只胳膊肘钩在横档上，然后屏住呼吸。被你的跳跃打断的混凝土从下面发出的铿锵声。你把你的自由手臂向上扔到下一个横档，用双臂拉，让一个膝盖向上。然后，它只是一个梯子。你放慢呼吸，集中精力不滑倒，爬回水面。相比之下，外面的世界显得喧闹多风。但也很安全。
"//table[@name=""encounters""]/column[@name=""id""][text()=1067]/../column[@name=""strName""]",Return to cistern lid,返回水箱盖
"//table[@name=""encounters""]/column[@name=""id""][text()=1067]/../column[@name=""strDesc""]",You've returned to the mini trash alley that leads to the Isotope Mine. You retrace your steps to that cistern lid you discovered.,你回到了通往同位素矿的迷你垃圾巷。你原路返回你发现的水箱盖。
"//table[@name=""encounters""]/column[@name=""id""][text()=1069]/../column[@name=""strName""]",Return to Isotope Mine Ladder,返回同位素矿梯
"//table[@name=""encounters""]/column[@name=""id""][text()=1069]/../column[@name=""strDesc""]",You've returned to the hole leading down into the cistern.,你回到了通向蓄水池的洞里。
"//table[@name=""encounters""]/column[@name=""id""][text()=1070]/../column[@name=""strName""]",Cross the Lobby cont'd,穿过大厅续
"//table[@name=""encounters""]/column[@name=""id""][text()=1070]/../column[@name=""strDesc""]","You vividly recall the alpha male sinking his fangs deep into the neck of the mammoth. Working his big jaw from side to side until blood gushed in a torrential outpouring straight towards the camera. 

Backing away slowly, so as not to disturb its... whatever it's doing, you step back outside.

You're careful not to lose sight of that doorway until you're clear of the entrance.",你清楚地记得雄性首领把他的尖牙深深地咬进猛犸象的脖子。他的大下巴左右摆动，直到鲜血如洪流般直奔镜头。慢慢后退，以免打扰它的...不管它在做什么，你都退到外面去。在你离开入口之前，你要小心不要看不见那扇门。
"//table[@name=""encounters""]/column[@name=""id""][text()=1075]/../column[@name=""strName""]",Run Software,运行软件
"//table[@name=""encounters""]/column[@name=""id""][text()=1075]/../column[@name=""strDesc""]","Not enough charge left in the laptop.

You start up the application, but before long, it becomes clear that the algorithm could run as long as half an hour, and you'll need at least that much charge in the laptop to complete the process.",笔记本电脑中剩余的电量不足。你启动了应用程序，但没过多久，你就会发现，这个算法可能会运行半小时之久，而你至少需要笔记本里有这么多电才能完成这个过程。
"//table[@name=""encounters""]/column[@name=""id""][text()=1080]/../column[@name=""strName""]",Using Computer,使用电脑
"//table[@name=""encounters""]/column[@name=""id""][text()=1080]/../column[@name=""strDesc""]","Welcome to NanoSoft Home!

Please choose the desired action from the list below.",欢迎访问NanoSoft首页!请从下面的列表中选择所需的操作。
"//table[@name=""encounters""]/column[@name=""id""][text()=1082]/../column[@name=""strName""]",Target device w/Insufficient Charge,目标设备/电量不足
"//table[@name=""encounters""]/column[@name=""id""][text()=1082]/../column[@name=""strDesc""]","Not enough charge left in the target device.

You start up the application, but before long, it becomes clear that the algorithm could run as long as half an hour, and you'll need at least that much charge in the device to complete the process.",目标设备中没有足够的剩余电量。你启动应用程序，但没过多久，你就会发现，该算法可能会运行半小时之久，而你的设备至少需要这么多电才能完成这一过程。
"//table[@name=""encounters""]/column[@name=""id""][text()=1083]/../column[@name=""strName""]",Using iSlab,使用iSlab
"//table[@name=""encounters""]/column[@name=""id""][text()=1083]/../column[@name=""strDesc""]",Choose the app you'd like to launch from the list below.,从下面的列表中选择你想启动的应用程序。
"//table[@name=""encounters""]/column[@name=""id""][text()=1084]/../column[@name=""strName""]",Using smartphone,使用智能手机
"//table[@name=""encounters""]/column[@name=""id""][text()=1084]/../column[@name=""strDesc""]",Choose the app you'd like to launch from the list below.,从下面的列表中选择你想启动的应用程序。
"//table[@name=""encounters""]/column[@name=""id""][text()=1103]/../column[@name=""strName""]",Use GPS App,使用 GPS 应用程序
"//table[@name=""encounters""]/column[@name=""id""][text()=1103]/../column[@name=""strDesc""]","Even after civilization has crumbled, some of the GPS satellite network remains operational.",即使在文明崩溃之后，一些 GPS 卫星网络仍然可以运行。
"//table[@name=""encounters""]/column[@name=""id""][text()=1104]/../column[@name=""strName""]",Use GPS App,使用 GPS 应用程序
"//table[@name=""encounters""]/column[@name=""id""][text()=1104]/../column[@name=""strDesc""]","Even after civilization has crumbled, some of the GPS satellite network remains operational.",即使在文明崩溃之后，一些 GPS 卫星网络仍然可以运行。
"//table[@name=""encounters""]/column[@name=""id""][text()=1110]/../column[@name=""strName""]",Booth Empty,空亭子
"//table[@name=""encounters""]/column[@name=""id""][text()=1110]/../column[@name=""strDesc""]","You're outside the DSB Gate 11 microbranch, now empty and locked.",你在 DSB 11号微型支行的外面，现在那里已经空无一人，并且锁上了。
"//table[@name=""encounters""]/column[@name=""id""][text()=1111]/../column[@name=""strName""]",Pick the booth's lock.,撬开亭子的锁。
"//table[@name=""encounters""]/column[@name=""id""][text()=1111]/../column[@name=""strDesc""]","Under normal circumstances, picking a lock in plain view on some busy sidewalk is a dumb move.

Under these circumstances, it still is. You work your magic on the lock, but by the time you're seated at the terminal, someone outside is already on their mobile. Probably talking to the police.

There's no sign of the teller yet, but you're betting your time here is limited.

Damn that good Samaritan.",在正常情况下，明目张胆地在繁忙的人行道上撬锁是一种愚蠢的举动。在这种情况下，依然是。你对锁进行了一番操作，但当你坐在终端前时，外面有人已经在打手机。可能是在和警方通话。目前还没有出纳员的踪迹，但你打赌你在这里的时间不多了。真是该死的好心人。
"//table[@name=""encounters""]/column[@name=""id""][text()=1116]/../column[@name=""strName""]",Wait for the teller to leave.,等待出纳员离开。
"//table[@name=""encounters""]/column[@name=""id""][text()=1116]/../column[@name=""strDesc""]","You find a position with a good vantage point, and stare at the booth like a psycho for a while.

The booth doesn't garner a lot of foot traffic, which might explain why there are so few of them around town.

As you're waiting, you think she spots you, but you can't be sure. Waiting a bit longer, she starts talking on her mobile, and glances your way, looking down again when she sees you.

It appears you've been made.

As you hurry down the sidewalk, faint sirens can be heard echoing through the canyon of skyscrapers.",你找了个有利的位置，像个神经病一样盯着亭子看了一会儿。这个亭子的人流量并不大，这也许可以解释为什么城里很少有这样的亭子。在等待的过程中，你觉得她发现了你，但你不能确定。又等了一会儿，她开始用手机通话，并向你这边瞥了一眼，看到你后又低下了头。看来你已经被发现了。当你匆匆走在人行道上时，微弱的警笛声在摩天大楼的峡谷中回荡。
"//table[@name=""encounters""]/column[@name=""id""][text()=1120]/../column[@name=""strName""]","Teller Flees, Calls Police",出纳员逃走并报警
"//table[@name=""encounters""]/column[@name=""id""][text()=1120]/../column[@name=""strDesc""]","You've got access to the computer now, but not much time. The threatening of a bank employee is sure to be high on the police priority list.",你现在可以访问电脑了，但时间不多了。威胁银行员工的行为肯定会被警方列为优先处理事项。
"//table[@name=""encounters""]/column[@name=""id""][text()=1123]/../column[@name=""strName""]",Your Confiscated Items,你被没收的物品
"//table[@name=""encounters""]/column[@name=""id""][text()=1123]/../column[@name=""strDesc""]","You are taken to collect your things. ""Don't forget anything. Abandoned items will be destroyed,"" the guard warns.

Better make sure you empty that locker while you have the chance.","你被带去取你的东西。""别忘记任何东西，遗弃的物品将被销毁。""警卫警告说。最好确保在有机会的时候清空你的储物柜。"
"//table[@name=""encounters""]/column[@name=""id""][text()=1140]/../column[@name=""strName""]",Run away from the skybike!,逃离天空摩托！
"//table[@name=""encounters""]/column[@name=""id""][text()=1140]/../column[@name=""strDesc""]","You steel your nerves, and bolt, veering left immediately.

A flash of red emits from the skybike's undercarriage, and your body is painted in a flickering cross-hatched pattern.

You hear a beep, followed by a loud ""pow!""

Something slams into you, and you collapse instantly, muscles seizing uncontrollably. Unable to move, see, or even hear straight, the world is an agonizing blur as you flop on the asphalt.","你绷紧神经，立即向左猛冲。天空摩托车的底部闪出一道红光，你的身体被一个闪烁的交叉图案笼罩。你听到一声哔哔声，然后是巨大的 ""砰！""声。 有东西猛地撞向你，你瞬间倒下，肌肉不受控制地抽搐起来。你无法动弹，无法看清东西，甚至无法听到声音，当你倒在沥青路面上时，整个世界都变得模糊不清。"
"//table[@name=""encounters""]/column[@name=""id""][text()=1141]/../column[@name=""strName""]",Sprint away from the skybike!,从天空摩托旁飞奔而去！
"//table[@name=""encounters""]/column[@name=""id""][text()=1141]/../column[@name=""strDesc""]","You steel your nerves, and bolt, veering left immediately.

A flash of red emits from the skybike's undercarriage, and your body is painted in a flickering cross-hatched pattern.

You hear the engines change pitch as the vehicle reorients, a beep, followed by a loud ""pow!""

Something smacks against the ground near your feet, flashing arcs of electricity as it skitters.","你绷紧神经，立即向左猛冲。天空摩托车的底部闪出一道红光，你的身体被一个闪烁的交叉图案笼罩。你听到发动机的声音变调，车辆重新调整方向，接着是一声哔哔声，随后是巨大的 ""砰！""声。 有东西砸在你脚边的地面上，闪烁着电弧。"
"//table[@name=""encounters""]/column[@name=""id""][text()=1145]/../column[@name=""strName""]",DMC Questioning Return,底特律问询 返回
"//table[@name=""encounters""]/column[@name=""id""][text()=1145]/../column[@name=""strDesc""]","Well, this is familiar. You're back in the beige fortress, awaiting processing by DMC Perimeter Services.

Same old ceiling tiles. Same old filing cabinets. Same old missing persons...",好吧，这很熟悉。你又回到了米黄色的堡垒中，等待着底特律周边服务的处理。同样的天花板格子。同样的旧文件柜。同样的失踪人口...
"//table[@name=""encounters""]/column[@name=""id""][text()=1146]/../column[@name=""strName""]",Exiled from DMC,被底特律流放
"//table[@name=""encounters""]/column[@name=""id""][text()=1146]/../column[@name=""strDesc""]","You're escorted from the interview area, and brought into an on-site clinic, where you're strapped to a table, and anesthetized.

When you wake, you're on a bench in a painted cinder block room, leaning against a corner. Both your head and right shoulder ache. A piercing bleep fills the room as an intercom comes to life.

""You have been charged as follows:
-First-degree criminal trespassing
-Unauthorized access to a computer with intent to commit an offense
-Fraud and misuse of visas
-Conspiracy to defraud the city of Detroit
-Consorting with a known felon
-Failure to disclose personal information""","你被护送出审讯区然后被带到临场诊所，你被绑在桌子上并被麻醉。当你醒来时，你在一个粉刷过的水泥砖房间里的长凳上，就靠在角落里。你的头和右肩都在疼。一种刺耳的哔哔声充斥着房间，对讲机开始讲话了。""你被指控以下罪名： -一级非法入侵罪 -未经授权访问计算机，意图犯罪 -欺诈和滥用签证 -密谋欺骗底特律市 -与已知重罪犯勾结 -未披露个人信息"""
"//table[@name=""encounters""]/column[@name=""id""][text()=1147]/../column[@name=""strName""]",DMC Questioning - Exile I to II,底特律问询 - 流放 I 到 II
"//table[@name=""encounters""]/column[@name=""id""][text()=1147]/../column[@name=""strDesc""]","This time, when the case handler arrives, there's no talking. Just scribbling notes, cross-checking a nearby monitor, and a stern glance telling you you're not worth the effort.

A guard grabs your shoulder, and pushes you into the cinder block room with the blaring speakerphone.

A voice blares, ""Repeated violation of exile order is cause for term of sentence to be extended by 2 years. Subsequent violations may be subject to penalties including capital punishment, at the discretion of the arresting officer.""

A door on the opposite wall buzzes, and swings open to the familiar muddy streets outside the DMC walls.","这一次，当办案人员到达时，没有交流。只有潦草的笔记，检查附近的监视器，以及使用一个严厉的凝视告诉你不值得去做。一名警卫抓住你的肩膀并将你推进水泥砖砌成的房间，里面的扬声器滋滋作响。一个声音喊道, ""屡次违反流放令将延长2年刑期。之后的违规行为可能导致刑罚，包括死刑，由拘捕人员酌情决定。""对面墙上的一扇门嗡嗡作响，然后打开了，那是底特律墙外熟悉的泥泞街道。"
"//table[@name=""encounters""]/column[@name=""id""][text()=1148]/../column[@name=""strName""]",Denied Entry - Stolen Pass,拒绝入境 - 被盗的通行证
"//table[@name=""encounters""]/column[@name=""id""][text()=1148]/../column[@name=""strDesc""]","At the front of the line, the guard motions you closer. A moment of pregnant silence precedes a satisfying chirp, and the monitor flashes.

""Visitor Pass N6MAB11324 Authorized.""

You wait for them to let you pass but the guard speaks something to his comms. Another guard arrives and places a heavy-gloved hand on your shoulder. ""Alright, buddy, let's go.""

You're led to a gray door at the base of the south buttress, alongside a thin slit of mirrored windows.","在队伍的前头，警卫示意你靠近。一阵啁啾声打破了意味深长的沉默, 同时显示屏开始刷新。""访客通行证 N6MAA10816 嫌疑人被标记：拘留审讯。"" 你的肚子突然像被真空吸住了。警卫用穿着厚手套的手放在你的肩膀上。“好了，老兄，我们走吧。你被带到据点南部扶壁下的一扇灰色门前，旁边是一扇窄面窗户。"
"//table[@name=""encounters""]/column[@name=""id""][text()=1150]/../column[@name=""strName""]",Run away from the skybike!,逃离天空摩托！
"//table[@name=""encounters""]/column[@name=""id""][text()=1150]/../column[@name=""strDesc""]","You steel your nerves, and bolt, veering left immediately.

A flash of red emits from the skybike's undercarriage, and your body is painted in a flickering cross-hatched pattern.

You hear a beep, followed by a loud ""pow!""

Something slams into you, and you stagger a few steps as muscles clench near the impact.","你绷紧神经，立即向左猛冲。天空摩托车的底部闪出一道红光，你的身体被一个闪烁的交叉图案笼罩。你听到一声哔哔声，接着是一声巨响 ""砰！""什么东西撞击了你，你踉跄着退了几步，感到肌肉在撞击附近紧绷。"
"//table[@name=""encounters""]/column[@name=""id""][text()=1151]/../column[@name=""strName""]",Run underneath the skybike!,从天空摩托下面跑过去！
"//table[@name=""encounters""]/column[@name=""id""][text()=1151]/../column[@name=""strDesc""]","You steel your nerves, and bolt, charging directly under the skybike.

A flash of red emits from its undercarriage, and your body is painted in a flickering cross-hatched pattern.

You hear the engines change pitch as the vehicle reorients, a beep, followed by a loud ""pow!""

Something smacks against the ground near your feet, flashing arcs of electricity as it skitters.","你绷紧神经，猛地一跃，直接冲到了天空摩托的下方。飞天摩托车的底部闪出一道红光，你的身体被一个闪烁的交叉图案笼罩。你听到发动机的声音变调，车辆重新调整方向，接着是一声哔哔声，随后是巨大的 ""砰！""声。 有东西砸在你脚边的地面上，闪烁着电弧。"
"//table[@name=""encounters""]/column[@name=""id""][text()=1171]/../column[@name=""strName""]",Watch the teller log in.,观察出纳员登录。
"//table[@name=""encounters""]/column[@name=""id""][text()=1171]/../column[@name=""strDesc""]","Positioning yourself for optimal viewing, you await the teller's login.

However, a shout startles you out of your vigil. The technician's checklist goes on hold as she notices your staring, and starts speaking into her earpiece.

The teller's been alerted, too, and is standing up.

Things are about to get pretty hot here. Time to jet.",你调整好自己的位置，等待出纳员的登录。然而，一声喊叫打断了你的监视。技术人员注意到了你的凝视，开始对着耳麦说话，核对清单也随之暂停。出纳员也被惊动了，站了起来。情况很快会变得相当紧张。是时候离开了。
"//table[@name=""encounters""]/column[@name=""id""][text()=1187]/../column[@name=""strName""]",Human Meat Peddler,人肉贩子
"//table[@name=""encounters""]/column[@name=""id""][text()=1187]/../column[@name=""strDesc""]","As you turn to leave the market, you hear a bell ringing, its clanging reverberating through the honeycomb of shipping containers. You soon see angry sprawlers marching your way. You recognize one of them, the butcher that was buying meat. He heads towards you, scattergun in hand.

Everyone else stops, turning. Craning their necks to see around the crowd at the commotion.

""Flesh peddler!"" he shouts. ""Cannibal!""","当你转身离开市场时，你听到了铃声，它的铛铛声在蜂窝状的集装箱中回荡。你很快看到了愤怒的人们朝着你走来。你认出了其中一个，就是那个买肉的屠夫。他朝你走来，手里拿着散弹枪。其他人都停了下来，转过身。伸长他们的脖子去看周围人群的骚动。""肉贩子!"" 他大喊着。""食人族!"""
"//table[@name=""encounters""]/column[@name=""id""][text()=1191]/../column[@name=""strName""]",The Great Black Swamp cont'd,大黑沼泽 续
"//table[@name=""encounters""]/column[@name=""id""][text()=1191]/../column[@name=""strDesc""]","And the silence here is deafening. No birds, nor critters. Not even insects. Nothing stirs in this caustic swamp of destruction.

Nothing lives here.

Or at least, nothing should.","这里的寂静令人无法承受。没有鸟，也没有动物。连昆虫都没有。没有什么东西能够惊扰到这片能毁灭一切的腐蚀性沼泽。没有什么居住在这里。或者说, 没什么能在这里活下来的。"
"//table[@name=""encounters""]/column[@name=""id""][text()=1192]/../column[@name=""strName""]",Human Meat Peddler: Second Offense,人肉贩子：二次触犯
"//table[@name=""encounters""]/column[@name=""id""][text()=1192]/../column[@name=""strDesc""]","""Hey!"" a voice booms. The butcher's voice.

""Didn't I tell you?"" The market quiets to a murmur.

""I done told you, didn't I?"" He points his knife at you. ""I ever see you and human meat together, under this roof..."" and he draws the knife across his neck, in a cutting motion.","""嘿!"" 一声响起.屠夫的声音.""我没跟你说过么?""市场静悄悄的。""我跟你说过吧, 是吧?""他用刀指着你。""我要是再看见你和人肉一起在这里出现..."" 然后他用刀横在脖子前, 作出了一个切割的动作。"
"//table[@name=""encounters""]/column[@name=""id""][text()=1194]/../column[@name=""strName""]",Ask about the power cell.,询问动力电池。
