"//table[@name=""encounters""]/column[@name=""id""][text()=2]/../column[@name=""strName""]",Wake up in cryo facility,在冷冻设施中醒来
"//table[@name=""encounters""]/column[@name=""id""][text()=2]/../column[@name=""strDesc""]","You wake up disoriented, slumped over the base of an empty cryosleep pod, still damp from cryo fluid. The thick dust from the floor clings to your skin, leaving a clean spot on the ground, where a large ""05"" is painted.

Across the room, there is an open door to the hallway, and a broken window leading outside.

Just as you gather your wits, an unearthly scream erupts from down the hall beyond the doorway. Something is coming. Fast.","你从昏厥中苏醒，蜷缩在一个空荡荡的冷冻睡眠舱内，里面的冷冻液还没干，地板上厚厚的灰尘粘在你的皮肤上。地面上一处干净的地方，上面涂有一个大大的 ""05"" 字样。在房间的另一边，有一扇通往走廊的开门，还有一扇通向外面的破窗。就在你收拾心情的时候，一声不祥的尖叫从大厅的深处传来。有什么东西马上就要来了！利用你的所有能力想想该怎么做？快！"
"//table[@name=""encounters""]/column[@name=""id""][text()=26]/../column[@name=""strName""]",DMC Gates,底特律大门
"//table[@name=""encounters""]/column[@name=""id""][text()=26]/../column[@name=""strDesc""]","Navigating the twisty maze of shacks and tarp shelters, Detroit's massive walls stand as a constant backdrop to the east.

Easily half a dozen stories high, and probably almost as thick, the city walls are an impressive sight to behold. Armed towers, bristling with surveillance arrays, stand at regular intervals, keeping watch over the Sprawl, and likely the city within.

Before you, giant vidscreens on the three gatehouses flash instructions about pass requirements and threat levels, as flocks of people stream into and out of the gates.

You take your place in line on the right, with the others entering the city.","你穿行在拥挤杂乱的被棚屋油布帐篷构造成迷宫的延伸区中,底特律的高墙就像东边的一面巨大的幕布。城墙无疑有数十米那么高，甚至也有可能数十米那么厚，十分令人印象深刻。密密麻麻的监视阵列与全副武装的哨塔不停地扫描着出入口，监视着这围墙的内外。在你面前，三个报关所上的巨型录像屏幕不停地闪烁着关于通行证要求和威胁级别的指令，进出城的人群像流水线一般。你站在右边排队，与其他人一起进入城市。"
"//table[@name=""encounters""]/column[@name=""id""][text()=27]/../column[@name=""strName""]",First Visit to the House at Seven Gables Road,第一次去七山墙路的房子
"//table[@name=""encounters""]/column[@name=""id""][text()=27]/../column[@name=""strDesc""]","As you make your way down old Seven Gables Road, you feel a growing sense of unease. There's an unnatural silence here, except for the whispering of air moving through branches bare of all but a few dead leaves. Your footsteps are impossibly loud on the waterlogged bed of reeds and leaves, announcing your presence.

Ahead, you can see the silhouette of the house: dark, lonely, and in disrepair. The old split-level looks like it may have been a home for a family once, judging by the rusty swingset.",当你沿着老七山墙路前行时，你会感到越来越不安。这里有一种不自然的寂静，除了空气穿过除了几片枯叶之外什么都没有的树枝的低语。你的脚步声在芦苇和树叶的积水床上大得不可思议，宣告着你的存在。在前方，你可以看到房子的轮廓：黑暗、孤独、年久失修。从生锈的秋千来看，旧的错层看起来可能曾经是一个家庭的家。
"//table[@name=""encounters""]/column[@name=""id""][text()=30]/../column[@name=""strName""]",Entering Detroit Mega City,进入底特律大都市
"//table[@name=""encounters""]/column[@name=""id""][text()=30]/../column[@name=""strDesc""]","At the front of the line, the guard motions you closer. A moment of pregnant silence precedes a satisfying chirp, and the monitor flashes.

""Visitor Pass N6MAA10816 Authorized.""

The guard takes you into a small room with a table in the middle. They confiscate weapons and other specific items not allowed in the city, and then give them back.

""Alright, buddy, put your things on the table,"" the guard instructs and you comply. The guard then ushers you forward, and you begin down a long-ish stretch of empty corridor lined with harsh xenon lighting.

Beyond the opening at the other end, you see throngs of activity and the flicker of busy signage eclipsed by passing people.","在队伍的前头，警卫示意你靠近。一阵啁啾声打破了意味深长的沉默, 同时显示屏开始刷新。""访客通行证 N6MAA10816 已授权。""警卫带你进入一个中间有一张桌子的小房间。他们没收武器和其他不允许带进城中的特定物品，之后再物归原主。""好吧，伙计，把你的东西放在桌子上,"" 警卫指示你，你遵从了。警卫随后把你领到最前面，你开始沿着一条带有强烈的氙灯照明的空走廊行走。在另一端的入口之外，你看到了人山人海和闪烁的招牌，这些都被不断经过的人群遮挡住了。"
"//table[@name=""encounters""]/column[@name=""id""][text()=31]/../column[@name=""strName""]",Give Hatter the urn.,把骨灰盒交给哈特
"//table[@name=""encounters""]/column[@name=""id""][text()=31]/../column[@name=""strDesc""]","""It hardly seems worth the fuss,"" Hatter says as you hand him the urn. ""I'd almost forgo my end of the payment to know the story behind it.""

He places the urn in a safe, then locks it. ""But it's not worth the hit to my reputation."" He reaches into a desk drawer, and produces a black wristband. ""As agreed, your visitor's pass.""

""I will now message my contact so they add you to the system. We already have images of your face from the security cameras so that's one thing ready. That way your file actually appears when the guards scan your pass,"" Hatter says as he starts typing on his device.

As you ride the elevator car down through the building's innards once again, you wonder what to expect beyond DMC's massive gates.","""这几乎不值得如此大动干戈，"" 哈特说道，当你把骨灰瓶递给他时。""我几乎愿意放弃我的那部分报酬，只为知道它背后的故事。""他把骨灰瓶放进一个保险柜里，然后锁上了。""但这不值得使我声誉受损。""他从办公桌抽屉里拿出一个黑色手环。""如约，你的访客通行证。"" ""我现在会联系我的联系人，让他们把你添加到系统中。我们已经从监控摄像头中获取了你的面部图像，所以这方面已经准备好了。这样当保安扫描你的通行证时，你的档案就会出现，"" 哈特说着，开始在设备上打字。当你再次乘坐电梯穿过大楼内部时，你不禁想象在 DMC 巨大的大门之外会有什么等着你。"
"//table[@name=""encounters""]/column[@name=""id""][text()=33]/../column[@name=""strName""]",Denied Entry - No Pass,拒绝进入 - 无通行证
"//table[@name=""encounters""]/column[@name=""id""][text()=33]/../column[@name=""strDesc""]","When you reach the front of the line, a sinking feeling overcomes you. Heavily armed guards in full combat armor are checking attendees with some sort of scanning device. You're pretty sure that whatever these other folks have to get in, you're missing it.

When it's your turn, the guard stops you, and turns to a monitor installed in the wall. A message reads ""Device not detected. Entrance denied.""

With the efficiency and compassion of an assembly line worker, he directs you away from the line, back outside. Unfortunately, getting entrance to the city may be trickier than just showing up.","当你排到队伍的最前面时，一种沮丧的感觉袭上心头。身穿全副武装的警卫正在使用某种扫描设备检查进城者。你很确定，不管其他人必须要携带的东西是什么，你都没有。当轮到你的时候，警卫让你停下，并转向墙上安装的监视器。一条信息写道 ""未检测到设备，拒绝进入。""拒绝进入。”他以流水线工人的效率和同情心引导着你离开人群，回到外面。不幸的是，要进入这个城市可能比仅仅出现在这里更加棘手。"
"//table[@name=""encounters""]/column[@name=""id""][text()=35]/../column[@name=""strName""]",DMC Questioning,底特律问询
"//table[@name=""encounters""]/column[@name=""id""][text()=35]/../column[@name=""strDesc""]","Inside, under pale lighting, you're made to wait in restraints for hours. Drab cubicles divide most of the floor, and stern-looking operatives variously interview detainees, check computers, and disappear into other cubicles.

Your eyes mine every detail of the room, looking for anything interesting to settle on. White foam ceiling tiles, beige filing cabinets, black inbox/outbox trays, pine desktops...it's so sterile that it actually incites frustration.

Helpfully, informational posters and propaganda seem to be hung on display to add a splash of color. ""DMC Perimeter Services: We Care!"" and ""Contraband: It hurts all of us.""

The ""Missing Persons"" touchscreen was good for about an hour, but you've memorized all the faces by now.","询问室内，在苍白的灯光下，你不得不在限制中等待数小时。这里都是一个个单调的隔间,神情严肃的特工进行各种细节询问、电脑录入，最后又去了其他隔间。你仔仔细细地观察房间，想找点有趣的东西。白色泡沫天花板，米色文件柜，黑色的收件箱/发件箱托盘，松木桌面......它是如此无趣，以至于它实际上会引发沮丧感。令人欣慰的是， 信息海报和宣传品似乎被悬挂起来，以增加一抹色彩。底特律周边服务:交给我们!""和 ""走私:害人害己"" 那 ""寻人启事"" 的触屏让你排遣了一小时时光，但你现在已经把他们的脸全记住了。"
"//table[@name=""encounters""]/column[@name=""id""][text()=36]/../column[@name=""strName""]",Exiled from DMC,被底特律流放
"//table[@name=""encounters""]/column[@name=""id""][text()=36]/../column[@name=""strDesc""]","You're escorted from the interview area, and brought into an on-site clinic, where you're strapped to a table, and anesthetized.

When you wake, you're on a bench in a painted cinder block room, leaning against a corner. Both your head and right shoulder ache. A piercing bleep fills the room as an intercom comes to life.

""You have been charged as follows:
-Fraud and misuse of visas
-Conspiracy to defraud the city of Detroit
-Failure to disclose personal information""","你被护送出审讯区然后被带到临场诊所，你被绑在桌子上并被麻醉。当你醒来时，你在一个粉刷过的水泥砖房间里的长凳上，就靠在角落里。你的头和右肩都在疼。一种刺耳的哔哔声充斥着房间，对讲机开始讲话了。""你被指控以下罪名： -欺诈和滥用签证 -密谋欺诈底特律市 -未披露个人信息"""
"//table[@name=""encounters""]/column[@name=""id""][text()=37]/../column[@name=""strName""]",Denied Entry - Criminal Pass,拒绝进入 - 伪造的通行证
"//table[@name=""encounters""]/column[@name=""id""][text()=37]/../column[@name=""strDesc""]","At the front of the line, the guard motions you closer. A moment of pregnant silence precedes a satisfying chirp, and the monitor flashes.

""Visitor Pass N6MAC41717 Flagged: Detain for Questioning.""

Your gut suddenly feels like a vacuum. The guard places a heavy-gloved hand on your shoulder. ""Alright, buddy, let's go.""

You're led to a gray door at the base of the south buttress, alongside a thin slit of mirrored windows.","在队伍的前头，警卫示意你靠近。一阵啁啾声打破了意味深长的沉默, 同时显示屏开始刷新。""访客通行证 N6MAC41717 被标记：拘留审问。""你的内脏突然感觉像真空一样。警卫用重重的手套抓住你的肩膀。""好吧，伙计，走吧。""你被带到据点南部扶壁下的一扇灰色门前，旁边是一扇窄面窗户。"
"//table[@name=""encounters""]/column[@name=""id""][text()=38]/../column[@name=""strName""]","DMC Questioning - Basic, forged pass",底特律问询
"//table[@name=""encounters""]/column[@name=""id""][text()=38]/../column[@name=""strDesc""]","By the time your case handler arrives, you've counted the ceiling tiles, grouped them into shades of beige, and created an elaborate conspiracy linking all the missing persons.

Your handler leads you to his cubicle, and you're subjected to a battery of tests, including face scan, retinal scan, DNA sampling, fingerprinting, and a blood sample.

The interview is something of a comedy, with questions like ""What is your full name, address, and date of birth?""

And when asked where you obtained the forged pass, your answer is received less than enthusiastically.","当处理你案件的人到达时, 你已经把天花板分成不同米色块并细数过了，又将失踪人员联系起来编成一个阴谋故事。你被处理人带到他的隔间，进行整套录入, 包括面部扫描、视网膜扫描、DNA采样、指纹采样和血样采样。整个面谈有点像某种喜剧，伴随着像是这样的问题：""你的全名叫、住哪的、哪天出生？""当被问及你如何获得伪造通行证时，你的回答不太受欢迎。"
"//table[@name=""encounters""]/column[@name=""id""][text()=42]/../column[@name=""strName""]",Scavenging a hex,搜刮
"//table[@name=""encounters""]/column[@name=""id""][text()=42]/../column[@name=""strDesc""]","Looking around you, there appear to be a few areas worth checking out.",环顾四周，你发现有几个值得一探究竟的地方。
"//table[@name=""encounters""]/column[@name=""id""][text()=44]/../column[@name=""strName""]",Booby trap,傻瓜陷阱
"//table[@name=""encounters""]/column[@name=""id""][text()=44]/../column[@name=""strDesc""]","Booby trap!

You spring a hidden trap while trying to examine what looked like a hidden cache, and it causes some damage. You're lucky it didn't do worse.",傻瓜陷阱!当你试图调查一个看似隐蔽的箱子时弹出了一个隐藏的陷阱，它造成了一些伤害。你很幸运这并不严重。
"//table[@name=""encounters""]/column[@name=""id""][text()=45]/../column[@name=""strName""]",Scavenge a crumbling apartment building.,搜刮破败的公寓大楼
"//table[@name=""encounters""]/column[@name=""id""][text()=45]/../column[@name=""strDesc""]","You decide to check out a crumbling apartment building. It's a mess inside: broken bricks lay in piles, bits of glass strewn everywhere like glittering dust, water stains and dead leaves litter the outer edges of the building, and rock dust still covers areas sheltered from the elements.

Scavengers before you have obviously picked most of the easy scores clean, but a little elbow grease and some risk-taking might reward the intrepid treasure-seeker.",你决定检查一栋摇摇欲坠的公寓楼。碎砖成堆，玻璃碎片像闪闪发光的灰尘一样到处都是，水渍和枯叶散落在建筑物的外缘，到处都覆盖着岩石和灰尘。在你之前的拾荒者显然已经把大部分东西都搜刮走了，但稍微用点力气，冒点险，可能会给勇敢的寻宝者带来回报。
"//table[@name=""encounters""]/column[@name=""id""][text()=49]/../column[@name=""strName""]",Scavenge with a prying tool.,用撬棍搜刮
"//table[@name=""encounters""]/column[@name=""id""][text()=49]/../column[@name=""strDesc""]",Use a tool to pry barriers loose during scavenging.,在搜刮过程中使用撬棍工具撬松障碍物。
"//table[@name=""encounters""]/column[@name=""id""][text()=50]/../column[@name=""strName""]",Scavenge an abandoned apartment building.,搜刮废弃的公寓楼
"//table[@name=""encounters""]/column[@name=""id""][text()=50]/../column[@name=""strDesc""]","This concrete apartment building looks to be in better shape than most. Sure, the windows are all but gone and a giant fissure runs along one wall, but this place looks as if it could still provide suitable shelter for someone.

Perhaps that's what makes you feel so nervous about approaching it.",这栋混凝土公寓楼看起来比大多数公寓楼都要好。当然，窗户几乎都没了，一条巨大的裂缝沿着一面墙延伸到底，但这个地方看起来好像仍然可以为某人提供合适的住所。也许这就是让你对接近它感到如此紧张的原因。
"//table[@name=""encounters""]/column[@name=""id""][text()=51]/../column[@name=""strName""]",Scavenge an abandoned house.,搜刮废弃的房子
"//table[@name=""encounters""]/column[@name=""id""][text()=51]/../column[@name=""strDesc""]","The suburbs were hit hard in the collapse. With masses of people fleeing urban centers in search of supplies, and supernatural threats encroaching from the wilds, the suburbs became the front lines in a war for survival.

Still, houses like these are so numerous that some have been entirely missed by scavengers. And they tend to be less likely to fall over than the bigger buildings in urban centers.",郊区在崩溃中受到重创。由于大量的人群逃离城市中心寻找物资，以及野外的超自然威胁，郊区成为了这场生存战争的前线。尽管如此，像这样的房子随处可见，以至于有些房子完全被拾荒者所遗漏。而且它们往往比城市中心的大型建筑更不容易倒塌。
"//table[@name=""encounters""]/column[@name=""id""][text()=52]/../column[@name=""strName""]",Scavenge an abandoned mobile home.,搜刮废弃的移动房屋
"//table[@name=""encounters""]/column[@name=""id""][text()=52]/../column[@name=""strDesc""]","Like other suburban homes, mobile homes were on the front lines in a war between fleeing urban populations and supernatural hordes from the wilds. However, their smaller size often means there's less to be found in each.",像其他的郊区住宅一样，移动房屋在人们从城市逃离和野外超自然威胁的生存战争中同样处于前线。然而，由于它们的尺寸较小，因此在每个房屋中发现的东西通常较少。
"//table[@name=""encounters""]/column[@name=""id""][text()=53]/../column[@name=""strName""]",Scavenge an abandoned office tower.,搜刮废弃的办公大楼
"//table[@name=""encounters""]/column[@name=""id""][text()=53]/../column[@name=""strDesc""]","Due to their nature, office towers weren't primary looting targets during the food riots. More obvious targets got the most attention.

Later on, astute scavengers realized many offices had bottled water, and often kitchens. What's more, the supply closets often contained valuable survival tools. The supplies aren't expected to be great, but it's worth a shot.",由于其性质，办公大楼在食品骚乱期间并不是主要的抢劫目标。其他的目标得到了更多的关注。后来，精明的拾荒者意识到许多办公室内都有瓶装水，通常还有厨房。更重要的是，补给柜里往往有宝贵的生存工具。这些补给估计不会很好，但值得一试。
"//table[@name=""encounters""]/column[@name=""id""][text()=54]/../column[@name=""strName""]",Scavenge a destroyed office building.,搜刮被毁坏的办公大楼
"//table[@name=""encounters""]/column[@name=""id""][text()=54]/../column[@name=""strDesc""]","This office building is in ruins, and it's unlikely much survived its collapse. The creaking walls and ceiling are no boost to your confidence, either. Still, that may mean no one was brave enough (or perhaps desperate enough) to go in there.",这座办公大楼已成为废墟，不太可能有什么东西在倒塌中幸存下来。吱吱作响的墙壁和天花板也没有给你带来信心。不过，这可能意味着没有人有足够的勇气（或者是足够的绝望）进入那里。
"//table[@name=""encounters""]/column[@name=""id""][text()=55]/../column[@name=""strName""]",Scavenge a stretch of forest,搜刮一片森林
"//table[@name=""encounters""]/column[@name=""id""][text()=55]/../column[@name=""strDesc""]","This stretch of forest seems to almost flourish in the absence of human life. There's a good chance one could find food and raw materials in here if they knew what to look for.

Just watch out for creatures that make this forest their home...and hunting ground.",在没有人类生活的情况下，这片森林似乎几乎蓬勃发展。如果人们知道要找什么，很有可能在这里找到食物和原材料。要小心那些以这片森林为家的生物......和猎物。
"//table[@name=""encounters""]/column[@name=""id""][text()=56]/../column[@name=""strName""]",Scavenge a forest shack,搜刮森林小屋
"//table[@name=""encounters""]/column[@name=""id""][text()=56]/../column[@name=""strDesc""]","Being far removed from urban centers, this secluded shack may have more promise. However, it could also be the home of a survivalist or militia member, so beware of booby traps.",这个僻远的小屋离市区很远，可能有着更多的希望。然而，它也可能是生存者或民兵的家，因此要小心陷阱。
"//table[@name=""encounters""]/column[@name=""id""][text()=57]/../column[@name=""strName""]",Scavenge an open field,搜刮一片空地
"//table[@name=""encounters""]/column[@name=""id""][text()=57]/../column[@name=""strDesc""]","Open fields are scavengers' worst options, as anything of value here was likely already spotted and taken. Plus, there's hardly anywhere to hide. 

But hey, beggars can't be choosers.",空地是拾荒者最糟糕的选择，因为这里任何有价值的东西都可能已经被发现并拿走了。另外，这里几乎没有地方可以藏身。但嘿，乞丐是不能挑剔的。
"//table[@name=""encounters""]/column[@name=""id""][text()=58]/../column[@name=""strName""]",Scavenge a storage shed.,搜刮储藏室
"//table[@name=""encounters""]/column[@name=""id""][text()=58]/../column[@name=""strDesc""]","Storage sheds are mixed bags. Ostensibly there should be some goods inside. But then again, anyone here before you would've known that and cleaned it out. Still, it's worth a shot.",储藏室有着很多袋子。表面上看里面应该有一些货物。但话又说回来，在你之前的任何人都会知道这一点并把它搜刮掉。不过，这还是值得一试的。
"//table[@name=""encounters""]/column[@name=""id""][text()=60]/../column[@name=""strName""]",Pick the locks on the shed.,撬开锁
"//table[@name=""encounters""]/column[@name=""id""][text()=60]/../column[@name=""strDesc""]","Luckily, you were prepared for just such an occasion.

Now, let's see what's in here...",幸运的是，你已经为这样的场合做好了准备。现在，让我们看看这里有什么...
"//table[@name=""encounters""]/column[@name=""id""][text()=63]/../column[@name=""strName""]",Force your way past the lock.,强行撬开锁
"//table[@name=""encounters""]/column[@name=""id""][text()=63]/../column[@name=""strDesc""]","Luckily, you were prepared for just such an occasion.

Now, let's see what's in here...",幸运的是，你已经为这样的场合做好了准备。现在，让我们看看这里有什么...
"//table[@name=""encounters""]/column[@name=""id""][text()=65]/../column[@name=""strName""]",DMC Junk Market,底特律垃圾市场
"//table[@name=""encounters""]/column[@name=""id""][text()=65]/../column[@name=""strDesc""]","The Junk Market

As you navigate the winding alleys of DMC's Sprawl, you encounter a huge structure fashioned of shipping containers. Throngs of people enter and exit the structure through a doorway on one side. 

Inside, you can see a thriving bazaar where people trade scavenged items in the light of a thousand lanterns and bug zappers. The air is thick with sweat, smoke, and the smell of barbecue and spices.

This is the Sprawl's notorious Junk Market.",垃圾市场 当你在DMC延伸区的蜿蜒小巷中穿行时，你会遇到一个由集装箱制成的巨大结构。成群结队的人通过一侧的门口进出这个结构。在里面，你可以看到一个繁荣的集市，人们在千百个灯笼和驱虫器的照耀下交易捡来的物品。空气中弥漫着汗水、烟雾、烤肉还有香料的味道。这是延展区臭名昭著的垃圾市场。
"//table[@name=""encounters""]/column[@name=""id""][text()=68]/../column[@name=""strName""]",Dive Through the Window II,爬出窗外 II
"//table[@name=""encounters""]/column[@name=""id""][text()=68]/../column[@name=""strDesc""]","The distant report of a gun disrupts your thoughts. You cock your head, listening, but it's over as quickly as it started.

Obviously, you're not alone out here. Though that doesn't necessarily comfort you.

Taking a look around you, you decide to start searching for some answers, not to mention supplies.",远处的枪声打断了你的思路。你歪着头听着，但很快就结束了。显然，你在这里不是一个人。虽然这不一定能让你感到安慰。看看你周围，你决定开始寻找一些答案，更不用说物资了。
"//table[@name=""encounters""]/column[@name=""id""][text()=71]/../column[@name=""strName""]",Scavenge using a squirrel snare,使用松鼠夹进行捕猎
"//table[@name=""encounters""]/column[@name=""id""][text()=71]/../column[@name=""strDesc""]",Use a squirrel snare to catch squirrels.,用松鼠夹捕捉松鼠。
"//table[@name=""encounters""]/column[@name=""id""][text()=72]/../column[@name=""strName""]",Hatter's Office,哈特的办公室
